{
  "schema": "aureon.public-claim-evidence-register.v1",
  "generated_at": "2026-07-26T00:00:00Z",
  "scope": "material public website positioning claims",
  "authority": {
    "scope": "read-only public-claim evidence control",
    "release_eligible": false,
    "deployment_authority": "none",
    "package_authority": "none",
    "human_review": "required for material public wording changes"
  },
  "claims": [
    {
      "id": "company-research-led-systems",
      "title": "Aureon company positioning",
      "claim": "Aureon Zorza Technologies is a research-led systems and innovation company.",
      "state": "company-authored",
      "boundary": "HNC is Aureon's proposed common systems grammar, not established universal science. Aureon OS is the company-built local-first software organism, not proof of autonomous production operation. Evidence OS is the provenance, authority and review control plane within Aureon OS, not the whole company or independent assurance. A blade is an evidence-labelled application route, not a customer deployment, partnership, investment outcome or independent validation.",
      "permitted_wording": [
        "Aureon Zorza Technologies is a research-led systems and innovation company.",
        "Aureon presents itself as a research-led systems and innovation company."
      ],
      "prohibited_inferences": [
        "market leadership",
        "independent validation",
        "customer adoption",
        "funding outcome"
      ],
      "expires_on": "2027-07-26",
      "source": {
        "path": "website/data/blades.json",
        "sha256": "F114A72A182FCDAD61953F92B0C9C5812362B6FAC4B8A27F7DB6EBED7A4946C2",
        "locator": "$.positioning.company",
        "evidence_texts": [
          "Aureon Zorza Technologies is a research-led systems and innovation company."
        ],
        "boundary_text": "HNC is Aureon's proposed common systems grammar, not established universal science. Aureon OS is the company-built local-first software organism, not proof of autonomous production operation. Evidence OS is the provenance, authority and review control plane within Aureon OS, not the whole company or independent assurance. A blade is an evidence-labelled application route, not a customer deployment, partnership, investment outcome or independent validation."
      },
      "public_routes": [
        "/",
        "/about/",
        "/projects/"
      ]
    },
    {
      "id": "hnc-research-framework",
      "title": "Harmonic Nexus Core research position",
      "claim": "Harmonic Nexus Core is Aureon's evolving research and systems-method framework.",
      "state": "research-proposition",
      "boundary": "HNC is being developed as a field of inquiry and reusable systems method. Public records establish authorship and availability; they do not establish an accepted scientific field, universal validity or independent validation.",
      "permitted_wording": [
        "Harmonic Nexus Core is Aureon's evolving research and systems-method framework.",
        "Aureon presents HNC as an evolving, source-linked research framework."
      ],
      "prohibited_inferences": [
        "established scientific field",
        "universal validity",
        "independent validation",
        "peer review"
      ],
      "expires_on": "2027-07-26",
      "source": {
        "path": "website/data/company-platform.json",
        "sha256": "53B4296E7FD12A3289D04876D3F1B52DA22D1CDED101133DE91E41A3630D62BC",
        "locator": "$[0].research_framework",
        "evidence_texts": [
          "Aureon's evolving research and systems-method framework",
          "Company-authored and source-linked research proposition"
        ],
        "boundary_text": "HNC is being developed as a field of inquiry and reusable systems method. Public records establish authorship and availability; they do not establish an accepted scientific field, universal validity or independent validation."
      },
      "public_routes": [
        "/",
        "/research/",
        "/vision/",
        "/about/"
      ]
    },
    {
      "id": "aureon-os-evidence-system",
      "title": "Aureon OS delivery system",
      "claim": "Aureon OS is a company-built engineering and evidence operating system.",
      "state": "public-source-available",
      "boundary": "Inspectable source and local test evidence do not establish production autonomy, customer adoption, operational safety or independently validated outcomes.",
      "permitted_wording": [
        "Aureon OS is a company-built engineering and evidence operating system.",
        "Aureon OS provides an inspectable company-built evidence-system implementation."
      ],
      "prohibited_inferences": [
        "production autonomy",
        "customer adoption",
        "operational safety",
        "independent validation"
      ],
      "expires_on": "2027-07-26",
      "source": {
        "path": "website/data/company-platform.json",
        "sha256": "53B4296E7FD12A3289D04876D3F1B52DA22D1CDED101133DE91E41A3630D62BC",
        "locator": "$[0].delivery_system",
        "evidence_texts": [
          "Company-built engineering and evidence operating system",
          "Public source available"
        ],
        "boundary_text": "Inspectable source and local test evidence do not establish production autonomy, customer adoption, operational safety or independently validated outcomes."
      },
      "public_routes": [
        "/",
        "/projects/",
        "/diligence/"
      ]
    },
    {
      "id": "mission-blades-application-model",
      "title": "Evidence-labelled mission blades",
      "claim": "Mission blades are evidence-labelled applications of the shared research and control logic.",
      "state": "prospective-application",
      "boundary": "Each application must earn its own domain evidence, qualified authority, buyer validation and retained decision record.",
      "permitted_wording": [
        "Mission blades are evidence-labelled applications of the shared research and control logic.",
        "Each mission blade is presented with its own evidence state and next validation gate."
      ],
      "prohibited_inferences": [
        "sector deployment",
        "buyer validation",
        "customer outcome",
        "independent validation"
      ],
      "expires_on": "2026-10-26",
      "source": {
        "path": "website/data/company-platform.json",
        "sha256": "53B4296E7FD12A3289D04876D3F1B52DA22D1CDED101133DE91E41A3630D62BC",
        "locator": "$[0].application_model",
        "evidence_texts": [
          "Evidence-labelled applications of the shared research and control logic",
          "Implemented core",
          "Tested prototype",
          "Sector programme",
          "Open research hypothesis"
        ],
        "boundary_text": "Each application must earn its own domain evidence, qualified authority, buyer validation and retained decision record."
      },
      "public_routes": [
        "/projects/",
        "/vision/",
        "/funding/"
      ]
    },
    {
      "id": "orcid-research-identity",
      "title": "Persistent research identity",
      "claim": "ORCID provides a persistent researcher identity and public work index.",
      "state": "public-research-record",
      "boundary": "A public ORCID, Zenodo or ResearchGate record establishes attribution and source availability only. It does not establish peer review, independent scientific or engineering validation, product readiness, commercial performance, customer adoption, funding or endorsement.",
      "permitted_wording": [
        "ORCID provides a persistent researcher identity and public work index.",
        "Use the linked ORCID record to inspect authorship and public research records."
      ],
      "prohibited_inferences": [
        "peer review",
        "independent scientific validation",
        "product readiness",
        "commercial performance"
      ],
      "expires_on": "2027-07-26",
      "source": {
        "path": "website/data/research-catalogue.json",
        "sha256": "6048D03C061C87D92EBA9B4A0BCFA41393F2F0CE8CAF5A25AE7A4503071DB867",
        "locator": "$.orcid",
        "evidence_texts": [
          "Persistent researcher identity and public work index",
          "0009-0004-2792-4649"
        ],
        "boundary_text": "A public ORCID, Zenodo or ResearchGate record establishes attribution and source availability only. It does not establish peer review, independent scientific or engineering validation, product readiness, commercial performance, customer adoption, funding or endorsement."
      },
      "public_routes": [
        "/research/",
        "/publications/",
        "/about/"
      ]
    },
    {
      "id": "cross-sector-research-orientation",
      "title": "Cross-sector research orientation",
      "claim": "Aureon's public research orientation covers trustworthy AI, space systems, photonics, sensing and evidence-led engineering.",
      "state": "public-research-record",
      "boundary": "A public ORCID, Zenodo or ResearchGate record establishes attribution and source availability only. It does not establish peer review, independent scientific or engineering validation, product readiness, commercial performance, customer adoption, funding or endorsement.",
      "permitted_wording": [
        "Aureon's public research orientation covers trustworthy AI, space systems, photonics, sensing and evidence-led engineering.",
        "The published research orientation spans several technically demanding domains."
      ],
      "prohibited_inferences": [
        "sector validation",
        "customer adoption",
        "commercial performance",
        "independent engineering validation"
      ],
      "expires_on": "2026-10-26",
      "source": {
        "path": "website/data/research-catalogue.json",
        "sha256": "6048D03C061C87D92EBA9B4A0BCFA41393F2F0CE8CAF5A25AE7A4503071DB867",